{
  "schema_version": "research.job.v1",
  "id": "chain-highstiff-n96",
  "engine": "matlab",
  "operation": "chain_dynamics",
  "inputs": {},
  "parameters": {
    "case": "high_stiffness",
    "n": 96,
    "mass": {
      "kind": "values",
      "values": [
        0.9,
        0.9021052631578947,
        0.9042105263157895,
        0.9063157894736842,
        0.908421052631579,
        0.9105263157894737,
        0.9126315789473685,
        0.9147368421052632,
        0.9168421052631579,
        0.9189473684210526,
        0.9210526315789473,
        0.9231578947368422,
        0.9252631578947369,
        0.9273684210526316,
        0.9294736842105263,
        0.9315789473684211,
        0.9336842105263158,
        0.9357894736842105,
        0.9378947368421053,
        0.9400000000000001,
        0.9421052631578948,
        0.9442105263157895,
        0.9463157894736842,
        0.9484210526315789,
        0.9505263157894738,
        0.9526315789473685,
        0.9547368421052632,
        0.9568421052631579,
        0.9589473684210527,
        0.9610526315789474,
        0.9631578947368421,
        0.9652631578947368,
        0.9673684210526317,
        0.9694736842105264,
        0.9715789473684211,
        0.9736842105263158,
        0.9757894736842105,
        0.9778947368421053,
        0.9800000000000001,
        0.9821052631578948,
        0.9842105263157895,
        0.9863157894736843,
        0.988421052631579,
        0.9905263157894737,
        0.9926315789473685,
        0.9947368421052633,
        0.996842105263158,
        0.9989473684210527,
        1.0010526315789474,
        1.0031578947368422,
        1.0052631578947369,
        1.0073684210526317,
        1.0094736842105263,
        1.0115789473684211,
        1.013684210526316,
        1.0157894736842106,
        1.0178947368421054,
        1.02,
        1.0221052631578948,
        1.0242105263157895,
        1.0263157894736843,
        1.028421052631579,
        1.0305263157894737,
        1.0326315789473686,
        1.0347368421052632,
        1.036842105263158,
        1.0389473684210526,
        1.0410526315789475,
        1.0431578947368423,
        1.045263157894737,
        1.0473684210526317,
        1.0494736842105263,
        1.0515789473684212,
        1.0536842105263158,
        1.0557894736842106,
        1.0578947368421052,
        1.06,
        1.0621052631578949,
        1.0642105263157895,
        1.0663157894736843,
        1.068421052631579,
        1.0705263157894738,
        1.0726315789473686,
        1.0747368421052632,
        1.076842105263158,
        1.0789473684210527,
        1.0810526315789475,
        1.083157894736842,
        1.085263157894737,
        1.0873684210526315,
        1.0894736842105264,
        1.0915789473684212,
        1.0936842105263158,
        1.0957894736842106,
        1.0978947368421053,
        1.1
      ]
    },
    "stiffness": {
      "kind": "values",
      "values": [
        2000.0,
        2062.5,
        2125.0,
        2187.5,
        2250.0,
        2312.5,
        2375.0,
        2437.5,
        2500.0,
        2562.5,
        2625.0,
        2687.5,
        2750.0,
        2812.5,
        2875.0,
        2937.5,
        3000.0,
        3062.5,
        3125.0,
        3187.5,
        3250.0,
        3312.5,
        3375.0,
        3437.5,
        3500.0,
        3562.5,
        3625.0,
        3687.5,
        3750.0,
        3812.5,
        3875.0,
        3937.5,
        4000.0,
        4062.5,
        4125.0,
        4187.5,
        4250.0,
        4312.5,
        4375.0,
        4437.5,
        4500.0,
        4562.5,
        4625.0,
        4687.5,
        4750.0,
        4812.5,
        4875.0,
        4937.5,
        5000.0,
        5062.5,
        5125.0,
        5187.5,
        5250.0,
        5312.5,
        5375.0,
        5437.5,
        5500.0,
        5562.5,
        5625.0,
        5687.5,
        5750.0,
        5812.5,
        5875.0,
        5937.5,
        6000.0,
        6062.5,
        6125.0,
        6187.5,
        6250.0,
        6312.5,
        6375.0,
        6437.5,
        6500.0,
        6562.5,
        6625.0,
        6687.5,
        6750.0,
        6812.5,
        6875.0,
        6937.5,
        7000.0,
        7062.5,
        7125.0,
        7187.5,
        7250.0,
        7312.5,
        7375.0,
        7437.5,
        7500.0,
        7562.5,
        7625.0,
        7687.5,
        7750.0,
        7812.5,
        7875.0,
        7937.5,
        8000.0
      ]
    },
    "damping": {
      "alpha": 0.01,
      "beta": 2e-05
    },
    "forcing": {
      "nodes": [
        10,
        80
      ],
      "amplitudes": [
        0.4,
        0.3
      ],
      "frequencies_hz": [
        0.9,
        4.0
      ],
      "phases": [
        0.0,
        0.25
      ]
    },
    "t_end": 1.0,
    "n_samples": 2001,
    "solver": {
      "rel_tol": 1e-09,
      "abs_tol": 1e-12,
      "max_step": 0.001
    },
    "plot": true
  },
  "timeout_s": 600
}
