{
  "schema_version": "research.job.v1",
  "id": "chain-graded-n48",
  "engine": "matlab",
  "operation": "chain_dynamics",
  "inputs": {},
  "parameters": {
    "case": "graded",
    "n": 48,
    "mass": {
      "kind": "values",
      "values": [
        0.7,
        0.7148936170212765,
        0.7297872340425532,
        0.7446808510638298,
        0.7595744680851063,
        0.774468085106383,
        0.7893617021276595,
        0.8042553191489361,
        0.8191489361702127,
        0.8340425531914893,
        0.8489361702127659,
        0.8638297872340425,
        0.8787234042553191,
        0.8936170212765957,
        0.9085106382978723,
        0.9234042553191488,
        0.9382978723404255,
        0.9531914893617021,
        0.9680851063829787,
        0.9829787234042553,
        0.9978723404255319,
        1.0127659574468084,
        1.027659574468085,
        1.0425531914893615,
        1.057446808510638,
        1.0723404255319149,
        1.0872340425531914,
        1.102127659574468,
        1.1170212765957446,
        1.1319148936170211,
        1.146808510638298,
        1.1617021276595745,
        1.176595744680851,
        1.1914893617021276,
        1.2063829787234042,
        1.2212765957446807,
        1.2361702127659573,
        1.2510638297872338,
        1.2659574468085104,
        1.280851063829787,
        1.2957446808510638,
        1.3106382978723403,
        1.325531914893617,
        1.3404255319148937,
        1.3553191489361702,
        1.3702127659574468,
        1.3851063829787233,
        1.4
      ]
    },
    "stiffness": {
      "kind": "values",
      "values": [
        80.0,
        101.5625,
        82.5,
        104.6875,
        85.0,
        107.8125,
        87.5,
        110.9375,
        90.0,
        114.0625,
        92.5,
        117.1875,
        95.0,
        120.3125,
        97.5,
        123.4375,
        100.0,
        126.5625,
        102.5,
        129.6875,
        105.0,
        132.8125,
        107.5,
        135.9375,
        110.0,
        139.0625,
        112.5,
        142.1875,
        115.0,
        145.3125,
        117.5,
        148.4375,
        120.0,
        151.5625,
        122.5,
        154.6875,
        125.0,
        157.8125,
        127.5,
        160.9375,
        130.0,
        164.0625,
        132.5,
        167.1875,
        135.0,
        170.3125,
        137.5,
        173.4375,
        140.0
      ]
    },
    "damping": {
      "alpha": 0.03,
      "beta": 0.0008
    },
    "forcing": {
      "nodes": [
        5,
        24,
        40
      ],
      "amplitudes": [
        0.5,
        0.35,
        0.25
      ],
      "frequencies_hz": [
        0.6,
        1.7,
        3.2
      ],
      "phases": [
        0.0,
        0.5,
        1.1
      ]
    },
    "t_end": 1.5,
    "n_samples": 1501,
    "solver": {
      "rel_tol": 1e-09,
      "abs_tol": 1e-11,
      "max_step": 0.0015
    },
    "plot": true
  },
  "timeout_s": 600
}
